name,description,country,num_servings,total_time_minutes,user_ratings.score,user_ratings.count_positive,user_ratings.count_negative,nutrition.calories,nutrition.protein,nutrition.fat,nutrition.carbohydrates
Beef And Broccoli Stir-Fry,"It’s your favorite take-out dish, but made exactly to your liking. And just like the classic Chinese-American dish, this recipe works great as leftovers when reheated in a microwave or over the stove. If you want to freshen it up, just chop up and throw in whatever vegetables you have in the fridge, like onions, bell peppers, or even water chestnuts.",ZZ,4,30,0.9759949463044851,1545,38,297.0,25.0,17.0,10.0
Strawberry Cheesecake French Toast,"Indulge in a breakfast fantasy come true with strawberry cheesecake French toast. A luscious, creamy filling is nestled between slices of custard-soaked bread, topped with a cascade of ruby-red strawberries, creating a morning masterpiece like no other.",US,2,21,0.9259723964868256,1476,118,873.0,23.0,63.0,52.0
20-Minute One-Pan Pizza,"Whip up a mouthwatering one-pan pizza in just 20 minutes, perfect for those busy weeknights! This scrumptious, no-fuss recipe will have your taste buds dancing with delight.",US,2,20,0.8790363915940543,1715,236,1210.0,63.0,77.0,66.0
Baked Shrimp Scampi Linguine Pasta,"Dive into this scrumptious Baked Shrimp Scampi Linguine, a perfect blend of tender shrimp and linguine baked to perfection. You'll be savoring every bite of this garlicky, buttery goodness that's sure to impress your taste buds!",ZZ,4,28,0.9636752136752137,1804,68,655.0,30.0,36.0,46.0
Bacon Egg Cups,Bacon egg cups are a delicious and protein-rich breakfast option. Eggs and cheddar cheese are scrambled and placed into bacon-wrapped muffin cups.,ZZ,4,30,0.9398663697104677,1688,108,179.0,13.0,13.0,1.0
Simple Scrambled Eggs,"Simple scrambled eggs are a classic breakfast dish, perfect for a quick and easy meal any time of day.",US,4,15,0.937007874015748,1666,112,99.0,6.0,7.0,0.0
Tomato Basil Sausage Spaghetti,"This recipe is a simple and delicious pasta dish that features Italian sausage, tomatoes, garlic, and basil. It's easy to make and perfect for a quick weeknight dinner.",US,2,30,0.9692110327132777,1511,48,955.0,42.0,39.0,110.0
One-Pot Mexican Quinoa,"This easy, one-pot meal is bursting with Mexican-inspired flavors and loaded with protein-packed quinoa for a healthy and filling dinner.",US,4,30,0.9683053040103493,1497,49,412.0,15.0,14.0,60.0
The Ultimate Waffle,"Crispy on the outside and fluffy on the inside, this waffle is the perfect vessel for all your favorite toppings. Drizzle with maple syrup and melted butter, sprinkle with fresh berries and whipped cream, or even top with crispy fried chicken for the ultimate brunch mashup.",US,4,30,0.9526248399487837,1488,74,390.0,13.0,5.0,70.0
Egg Breakfast Cups,"For these egg breakfast cups, you don't need a fork or knife. Just pop them in your mouth and enjoy the explosion of flavor. They're packed with veggies and protein, making them the perfect grab-and-go breakfast!",ZZ,6,30,0.9590443686006825,1405,60,87.0,6.0,4.0,5.0
Hot Chocolate: The Undercover Lover,This hot chocolate recipe features a combination of milk and dark chocolate for a rich and decadent flavor. It's perfect for chocolate lovers who want a luxurious and indulgent drink.,US,1,20,0.9272727272727272,51,4,330.0,9.0,16.0,41.0
Jalapeño Poppers,"Spice up your appetizer game with these jalapeño poppers! These little bites pack a punch, with spicy jalapeños and creamy cheese all wrapped up crispy, smoky bacon. Serve them up with a side of ranch or blue cheese dressing and get ready to kick things up a notch.",US,8,30,0.9712746858168761,1623,48,93.0,2.0,9.0,1.0
Spinach Mushroom Pesto Spaghetti,"This pasta dish is packed with flavorful ingredients like sautéed mushrooms, spinach, and homemade pesto sauce.",US,2,30,0.9547945205479452,1394,66,1139.0,35.0,69.0,100.0
Hasselback Pizza Chicken,"Why choose between pizza and chicken when you can have both? This juicy chicken breast is stuffed with mozzarella cheese and topped with pizza sauce, pepperoni, and more cheese. Perfect for a quick and easy weeknight dinner.
",GB,1,30,0.9392684610075914,1361,88,589.0,69.0,31.0,3.0
Lemon Crinkle Cake Mix Cookies,"Pucker up for these zesty Lemon Crinkle Cake Mix Cookies that are a breeze to whip up! With their soft, chewy texture and delightful lemony tang, they're the perfect treat for any citrus lover.",US,12,22,0.9592518370073481,1436,61,159.0,2.0,3.0,29.0
Watermelon-Lime Slushie,"This watermelon lime slushie is a refreshing and hydrating way to beat the heat. Made with fresh watermelon and lime juice, it's the perfect summer drink.",ZZ,2,10,0.8884711779448622,1418,178,42.0,0.0,0.0,11.0
Peanut Butter Banana Oatmeal Muffins,"These muffins are a perfect breakfast treat, combining the classic flavors of peanut butter and banana with hearty oats for a filling and satisfying snack. They're easy to make and are perfect for meal prepping or as an on-the-go snack.",US,12,30,0.9137931034482759,1537,145,175.0,6.0,4.0,30.0
Creamy Chicken Chimichanga,"These crispy, golden-brown chimichangas are packed with tender chicken and creamy cheese, making for a decadent and satisfying meal.",US,6,30,0.9741119807344973,1618,43,631.0,45.0,34.0,34.0
90-Second Keto Bread,"Maybe you’re following the keto diet or maybe you’re just trying to cut back on carbs. In any case, that doesn’t mean you have to give up bread. This keto-friendly bread is made with some basic ingredients like almond flour, egg, butter, and Parmesan. The best part: You don’t even have to turn on the oven. This bread is cooked entirely in the microwave in about a minute and a half.",US,1,7,0.9404466501240695,1516,96,281.0,15.0,21.0,9.0
One-Pot Spicy Sausage And Broccoli Pasta,"This one-pot pasta has it all — protein, vegetables, carbs, and a spicy kick! Cooking the pasta in chicken stock and rendered sausage fat gives it tons of flavor, while the starches from the pasta combine with the stock and Parmesan to make a glossy sauce.",US,4,30,0.9496350364963504,1301,69,645.0,34.0,37.0,52.0
Maple-Glazed Salmon,"A delicious and healthy salmon dish with a sweet and savory maple glaze, perfect for a quick and easy weeknight dinner.",ZZ,2,15,0.9690920798454604,1505,48,466.0,18.0,27.0,40.0
Homemade Big Massive Burger,"This homemade big massive burger recipe is perfect for anyone looking to indulge in a delicious and satisfying meal. With juicy beef, melted cheese, and all the fixings, this burger is sure to hit the spot.",GB,1,25,0.9556025369978859,1356,63,,,,
Cheesy Chicken Enchiladas,"Delight in the warm, comforting embrace of cheesy chicken enchiladas, where tender chicken, melty cheese, and zesty sauce unite in a harmonious dance of flavor. One bite, and you'll be transported to a cozy Mexican cocina.",ZZ,2,25,0.9620817843866171,1294,51,630.0,35.0,22.0,68.0
Spaghetti With Fresh Tomato Sauce,"Twirl your fork into this vibrant Spaghetti with Fresh Tomato Sauce, a true Italian classic! Bursting with juicy tomatoes and aromatic basil, this dish will transport your taste buds straight to the heart of Italy.",ZZ,4,30,0.9726666666666667,1459,41,551.0,19.0,7.0,96.0
Meal Prep Chicken Burrito Bowls,"These hearty burrito bowls are packed with protein and fiber, making them the perfect meal prep option for busy weekdays.",ZZ,4,25,0.9652173913043478,1443,52,353.0,33.0,4.0,45.0
Hummus Caesar Salad,"Vegan caesar has never been easier thanks to this time saving hack! Using hummus as the base of the dressing gives you richness while being both nut and dairy free. Adjust the consistency to your liking by adding more hummus for a thicker dressing or more water for thinner. This dressing is packed with flavor thanks to brininess from the capers, cheesiness from the nutritional yeast, and umami from the miso. ",US,2,10,0.967741935483871,30,1,126.0,5.0,8.0,10.0
Blueberry Overnight Oats,"Wake up to a delightful breakfast with these Blueberry Overnight Oats! This no-cook recipe is a time-saver, packed with juicy blueberries and creamy yogurt for a nutritious and satisfying start to your day.",US,2,10,0.9450686641697877,1514,88,494.0,17.0,11.0,81.0
Cookies And Cream Mousse,"Whip up this dreamy Cookies and Cream Mousse for a delightful dessert experience! With a heavenly blend of crushed Oreos and creamy mousse, your taste buds will be dancing with joy.",US,2,22,0.9103107344632768,1289,127,547.0,3.0,45.0,47.0
Pigs In A Blanket,"Pigs in a blanket are a classic party food that never goes out of style. The warm and flaky pastry is wrapped around a savory hot dog, creating the perfect handheld snack. They're easy to make and always a crowd favorite.",US,18,25,0.9385432473444613,1237,81,108.0,3.0,9.0,3.0
Spinach & Mushroom Quesadilla,"This spinach and mushroom quesadilla is loaded with savory flavors and packed with nutritious veggies. The tender spinach and meaty mushrooms are complemented by melty cheese and a crispy tortilla, making it a delicious and satisfying meal or snack.",ZZ,2,25,0.956687898089172,1502,68,683.0,42.0,43.0,32.0
Easy Vegan Pasta Salad,"This colorful and delicious pasta salad is packed with veggies, herbs, and a tangy dressing, making it the perfect lunch or side dish for any occasion.",US,4,25,0.9418262150220913,1279,79,360.0,15.0,7.0,60.0
Birthday Cake Mix Cookies,"Celebrate every day like it's your birthday with these scrumptious Birthday Cake Mix Cookies! They're fun, easy to make, and bursting with colorful sprinkles, bringing joy to your taste buds.",US,12,22,0.9419272495213784,1476,91,223.0,2.0,9.0,34.0
"Egg, Avocado, & Tomato Toast",The Egg Avocado Tomato Toast is a delicious and healthy breakfast option that is perfect for a busy morning.,ZZ,1,15,0.9611419508326725,1212,49,,,,
Spinach Artichoke Mac & Cheese,"This spinach artichoke mac and cheese is a cheesy and comforting twist on a classic dish. With tender macaroni, creamy cheese sauce, and a tangy spinach and artichoke dip, this dish is sure to be a crowd-pleaser. Try it today for a delicious and indulgent meal.",US,3,22,0.9284615384615384,1207,93,1658.0,85.0,97.0,107.0
Instant Energy Ginger Citrus Spritz,This content is intended solely for users of legal drinking age. Drink responsibly.,US,6,0,0.8529411764705882,29,5,265.0,0.0,0.0,32.0
Chopped Mediterranean Salad,"Bursting with vibrant flavors, this Chopped Mediterranean Salad is a refreshing and nutritious way to enjoy your veggies. Dive into a colorful mix of crunchy cucumbers, juicy tomatoes, and creamy feta cheese, all tossed in a zesty lemon dressing for a taste of the Mediterranean in every bite.",US,4,15,0.9800687285223367,1426,29,147.0,4.0,10.0,12.0
Super Soft Banana Bread Cookies,These cookies are made with mashed bananas and have the texture and flavor of banana bread in cookie form,ZZ,24,30,0.956726986624705,1216,55,128.0,2.0,5.0,19.0
Buffalo Chicken Dip,"This creamy buffalo chicken dip is loaded with shredded chicken, hot sauce, and plenty of melty cheese. It's perfect for game day or any party. ",ZZ,4,30,0.9750201450443191,1210,31,345.0,9.0,31.0,4.0
Chickpea Salad Sandwich,"Say hello to your new lunchtime favorite: the Chickpea Salad Sandwich! This scrumptious, protein-packed delight is a fresh twist on the classic sandwich, perfect for a quick and satisfying meal.",US,3,15,0.9654919236417033,1315,47,315.0,12.0,12.0,38.0
Cheesy Broccoli Gnocchi,"This recipe combines soft and pillowy gnocchi with the delicious flavor of broccoli and the richness of cheese for a comforting and hearty meal. With just a few simple ingredients, this dish comes together quickly and easily, making it perfect for a weeknight dinner.",GB,4,20,0.9044585987261147,1136,120,555.0,28.0,24.0,58.0
Berry Smoothie Bowl,"Start your day with a refreshing and nutritious smoothie bowl filled with a mix of juicy berries, creamy banana, and leafy spinach. Topped with crunchy chia seeds, sliced almonds, and coconut, this breakfast bowl is the perfect balance of sweet and crunchy.",US,2,10,0.9354180829367778,1376,95,292.0,11.0,7.0,50.0
Chipotle Chickpea Tacos,"A spicy and flavorful vegan taco recipe featuring chipotle-spiced chickpeas, avocado, cabbage slaw, and lime crema.",US,2,15,0.9721980886185926,1119,32,375.0,20.0,7.0,58.0
Blueberry Banana Pancakes,"Start your day off right with these amazing pancakes! Packed with fresh blueberries and sweet bananas, these pancakes are a breakfast dream come true.",US,8,25,0.7882851093860268,1117,300,72.0,3.0,2.0,9.0
Tomato Basil Soup,"Dive into a bowl of this comforting Tomato Basil Soup that's bursting with flavor! It's the perfect dish to warm you up on a chilly day, and it's so easy to make, you'll be whipping it up in no time.",US,8,25,0.9572072072072072,1275,57,82.0,3.0,1.0,17.0
BBQ Chicken Sliders,"Make these BBQ chicken sliders, and you will steal the show at any gathering. These delectable mini burgers are filled with cooked shredded chicken and topped with a slather of barbecue sauce and layers of red onion, pepper Jack cheese, and chopped parsley, all nestled between pillowy dinner rolls or sweet Hawaiian rolls. With the convenience of store-bought BBQ sauce and leftover or store-bought rotisserie chicken, whipping up this crowd-pleaser is an absolute breeze. Whether it's a backyard barbecue, an impromptu get-together, or a game day feast, these mini shredded chicken BBQ burgers bursting with incredible flavor will bring yumminess and crowd-pleasing goodness. ",US,12,30,0.9813953488372092,1266,24,221.0,12.0,8.0,23.0
Snickerdoodle Cake Mix Cookies,"Whip up a batch of these scrumptious Snickerdoodle Cake Mix Cookies that are as easy as pie to make! With a delightful cinnamon-sugar coating, these soft and chewy treats will have you reaching for seconds in no time.",US,12,22,0.9504132231404959,1150,60,168.0,1.0,5.0,28.0
Healthy Blueberry Pancakes,These fluffy and delicious pancakes are packed with juicy blueberries and made with wholesome ingredients like whole wheat flour and unsweetened almond milk. Perfect for a healthy breakfast or brunch.,ZZ,4,30,0.8797856049004594,1149,157,195.0,6.0,3.0,34.0
Egg White Breakfast Cups ,"These protein-packed breakfast cups are perfect for meal prep or busy mornings. Made with fluffy egg whites, fresh spinach, and juicy tomatoes, they're a healthy and delicious way to start your day.",ZZ,6,25,0.9079042784626541,1252,127,121.0,10.0,7.0,1.0
Mixed Berry French Toast,"Revel in the sweet symphony of mixed berry French toast, as vibrant fruit mingles with golden, custard-soaked bread. This berrylicious delight is the perfect harmony of flavors, making every morning feel like a special occasion.",US,2,25,0.9546599496221663,1137,54,493.0,18.0,14.0,70.0
Sesame Peanut Noodles,These sesame peanut noodles are a deliciously tangy and nutty dish that's perfect for a quick lunch or dinner. ,US,4,25,0.926914968376669,1319,104,443.0,16.0,17.0,59.0
Thai Coconut Vegetable Curry,"Experience a taste of Thailand with this vibrant Thai Coconut Vegetable Curry! Packed with colorful veggies and simmered in a creamy coconut sauce, this dish is a delightful explosion of flavors.",US,8,25,0.9420544337137841,1073,66,253.0,7.0,11.0,32.0
Tuna Burgers,"These hearty burgers are made with canned tuna, breadcrumbs, and spices, then pan-fried until crispy and served on a bun with your favorite toppings.",US,4,25,0.9522998296422487,1118,56,301.0,34.0,11.0,13.0
French Pepper Steak (Steak Au Poivre),A classic French dish featuring tender and juicy steak coated in a peppery crust and served with a creamy brandy sauce.,US,2,30,0.9517509727626459,1223,62,1012.0,42.0,88.0,3.0
One-Pan Garlic Butter Salmon,"Experience the magic of a one-pan wonder with this scrumptious Garlic Butter Salmon recipe. Perfectly cooked salmon fillets are nestled in a heavenly garlic butter sauce, making for a quick and easy weeknight meal that's sure to impress!",ZZ,4,28,0.9745166959578208,1109,29,402.0,15.0,31.0,18.0
Cloud Eggs,"Impress your brunch guests with these light and fluffy Cloud Eggs! With their pillowy texture and delicious flavor, these eggs are sure to please.",GB,2,23,0.855166802278275,1051,178,73.0,6.0,4.0,0.0
One-Pan Honey Garlic Salmon & Asparagus,"This easy and delicious one-pan meal features flaky salmon, tender asparagus, and a sweet and savory honey garlic sauce that's a perfect complement to the flavors of the dish.",US,4,25,0.9559352517985612,1063,49,150.0,10.0,8.0,8.0
Chicken Fried Rice,"Add an irresistible twist to your mealtime repertoire with a heaping helping of this delectable fried rice. Revel in the harmonious union of tender chicken and an array of vibrant veggies, all mingling together in a sizzling symphony of flavor.",US,1,25,0.9682819383259912,1099,36,798.0,42.0,32.0,84.0
Pizza Toastie,"For a lazy night in, try this quick and delicious pizza toastie stuffed with cheese and pepperoni.",GB,1,15,0.9265988372093024,1275,101,905.0,34.0,81.0,7.0
Guacamole,"This guacamole recipe is loaded with fresh ingredients like avocados, lime juice, and jalapeño. It’s a quick and easy staple that packs a flavorful punch.",US,4,15,0.9658573596358119,1273,45,256.0,3.0,22.0,14.0
Pizza Bagels,"10 minutes to homemade pizza bagels! Ours are bigger (and better!) than the store-bought kind. Keep it classic with pizza sauce, mozzarella, and pepperoni, or swap in your favorite sauce and topping combo.",US,2,10,0.9520905923344948,1093,55,441.0,20.0,16.0,51.0
Crunchy Avocado Tuna Wraps,"These light and refreshing wraps are filled with a blend of tuna, avocado, and crunchy veggies, then wrapped in lettuce leaves for a healthy lunch or snack.",US,4,15,0.9204368174726989,1180,102,382.0,26.0,14.0,37.0
One-Pot Hot Dog Pasta,This one-pot hot dog pasta is the ultimate comfort food that's quick and easy to make. The addition of hot dogs gives it a playful twist that both kids and adults will enjoy.,US,4,30,0.9454713493530499,1023,59,589.0,17.0,49.0,24.0
French Omelette,"The French Omelette is a classic breakfast dish that is light, fluffy, and filled with delicious ingredients. Made with eggs, cheese, and herbs, this omelette is perfect for a fancy breakfast or brunch.",ZZ,1,10,0.9235668789808917,1160,96,323.0,19.0,26.0,1.0
Three Bean Salad,This easy and colorful three-bean salad is perfect for summer picnics or potlucks. The combination of creamy kidney beans and nutty chickpeas in a tangy dressing is a crowd-pleaser.,US,5,15,0.9705069124423963,1053,32,325.0,20.0,6.0,54.0
Sausage French Toast Roll-Ups,"Wake up to a delightful twist on a classic breakfast with these Sausage French Toast Roll-Ups! Savor the perfect combination of savory sausage and sweet French toast, all rolled up into one scrumptious bite.",US,3,25,0.9395910780669146,1011,65,569.0,34.0,43.0,9.0
PB&J Overnight Oats,"Upgrade your breakfast game with these scrumptious PB&J Overnight Oats! This no-cook, make-ahead recipe is perfect for busy mornings and combines the classic flavors of peanut butter and jelly in a nutritious and satisfying way. ",US,2,10,0.9172932330827067,1220,110,553.0,20.0,21.0,71.0
Blueberry Mug Muffin,"Looking for a quick and delicious breakfast? Try this Blueberry Mug Muffin! In just a few minutes, you can have a warm, fluffy muffin bursting with juicy blueberries. Perfect for those busy mornings when you're on the go!",US,1,9,0.8981549815498155,1217,138,525.0,7.0,25.0,66.0
Mixed Berry Smoothie Meal Prep,"Bursting with the sweet and tangy flavors of mixed berries, this smoothie is a nutritious and delicious way to start your day. Perfect for meal prep, this smoothie can be made in advance for a quick and easy breakfast.",ZZ,2,10,0.9362084456424079,1042,71,307.0,17.0,4.0,51.0
Classic Party Guacamole,"A classic guacamole recipe with creamy avocado, zesty lime, and fresh cilantro, perfect for any party or gathering. It's a crowd-pleaser that will have everyone reaching for more.",US,8,15,0.9648562300319489,1208,44,69.0,0.0,5.0,5.0
Popcorn Shrimp,"These popcorn shrimp are a crispy and delicious seafood snack that's perfect for any occasion. They're coated in a crispy cornmeal batter and served with a tangy cocktail sauce, making for a perfect party appetizer.",ZZ,3,25,0.9559808612440192,999,46,367.0,38.0,5.0,38.0
Breakfast Egg Cups,"Start your morning off on the right foot with these breakfast egg cups. With a protein-packed filling of eggs, turkey bacon, veggies, and cheese, they're like a healthy breakfast muffin that will keep you full all morning.",US,12,30,0.961576354679803,976,39,140.0,11.0,9.0,1.0
Bacon Avocado Caesar Salad,"This twist on a classic Caesar salad adds a smoky twist with crispy bacon and creamy avocado. Tossed with crisp romaine lettuce and a tangy Caesar dressing, this salad is a satisfying and flavorful meal.",ZZ,2,25,0.9690048939641109,1188,38,403.0,7.0,35.0,16.0
White Rice,"Getting fluffy, fully-cooked white rice without burning the bottom isn’t hard, but there are a few steps to make the process a little easier. You’ll always want to rinse white rice in a sieve until the water is clear to remove excess starch that can make the rice gummy and unevenly cooked. You should also let the rice steam for five minutes before you fluff with a fork, so that the rice doesn’t dry out or get clumpy. Enjoy your now-perfect rice!",US,4,28,0.9543245869776482,982,47,211.0,5.0,0.0,45.0
Chocolate Peanut Butter Pancakes,"Whip up a stack of these scrumptious Chocolate Peanut Butter Pancakes for a breakfast that'll make your taste buds dance! With a heavenly blend of chocolate and peanut butter, these fluffy flapjacks are perfect for a cozy morning treat.",ZZ,4,25,0.9310679611650485,959,71,290.0,10.0,13.0,43.0
Mini Cinnamon Roll Bites,"Bite-sized bliss awaits with these Mini Cinnamon Roll Bites! Perfect for a cozy morning treat, these scrumptious morsels will have you swooning over their warm, gooey cinnamon goodness.",US,12,25,0.8870523415977961,966,123,92.0,0.0,3.0,15.0
Spice-Rubbed Shrimp Tacos,"Experience a fiesta of flavors with these Spice-Rubbed Shrimp Tacos that'll make your taste buds dance! This easy-to-make recipe combines succulent shrimp, zesty spices, and fresh toppings for a mouthwatering meal that's perfect for Taco Tuesday or any night of the week.",US,8,0,0.9217391304347826,954,81,233.0,15.0,7.0,25.0
Chili Lime Steak Tacos,"Juicy, marinated steak is grilled to perfection and topped with a zesty chili lime sauce for a taco that packs a flavorful punch",ZZ,4,30,0.9500998003992016,952,50,184.0,12.0,13.0,5.0
Penne Alla Vodka,"Creamy, indulgent, and comforting, this pasta dish is perfect for a cozy night in. Penne pasta is cooked al dente and tossed with a rich and creamy tomato-vodka sauce.",US,2,20,0.9601196410767697,963,40,547.0,10.0,24.0,45.0
Tortilla Bowl Southwestern Salad,"A crispy tortilla bowl is filled with a colorful blend of greens, beans, corn, and avocado, then topped with a zesty lime dressing and a sprinkle of cheese for a filling and flavorful salad.",US,4,30,0.9658976930792377,963,34,402.0,8.0,22.0,45.0
Black Bean & Corn Burgers,"Bite into these scrumptious Black Bean Corn Burgers for a flavor fiesta in your mouth! Packed with protein and veggies, these patties are perfect for a guilt-free, meatless meal that'll leave you craving more.",US,4,25,0.965183752417795,998,36,553.0,25.0,13.0,82.0
Banana Chocolate Chip Breakfast Muffins,A breakfast recipe that uses ripe bananas and chocolate chips to make moist and flavorful muffins that are perfect for a quick breakfast or snack.,US,12,30,0.7307392996108949,939,346,200.0,7.0,4.0,35.0
Creamy Spinach-Stuffed Mushrooms,"These mushrooms are packed with a creamy spinach filling that's perfect for an appetizer or side dish. With just a few simple ingredients, they're easy to make and delicious to eat.",US,5,30,0.9733990147783251,988,27,226.0,7.0,17.0,12.0
Dalgona Coffee,"This trendy coffee drink features a whipped mixture of instant coffee, sugar, and milk, for a creamy and frothy caffeinated treat.",US,1,10,0.9114533205004812,947,92,132.0,1.0,0.0,28.0
Homemade Broccoli Cheese Soup,"This comforting, classic soup is made with fresh broccoli, sharp cheddar cheese, and a touch of cream for a velvety texture that will warm you up from the inside out.",ZZ,4,20,0.7983630952380952,1073,271,1078.0,58.0,67.0,61.0
Chocolate Chip Muffin Mug,"Whip up a delightful Chocolate Chip Muffin Mug in just minutes! This scrumptious, single-serving treat is perfect for satisfying your sweet tooth without the hassle of baking a whole batch.",ZZ,1,7,0.8181818181818182,1134,252,428.0,12.0,16.0,67.0
Pico De Gallo,"Dive into the vibrant flavors of this Pico de Gallo, a fresh and zesty salsa that'll make your taste buds dance! Perfect for dipping or topping your favorite dishes, this easy-to-make recipe is a must-try for any Mexican food lover.",US,2,10,0.985153764581124,929,14,27.0,0.0,0.0,6.0
Seared Scallops,Perfectly seared scallops are served on a bed of creamy risotto and garnished with fresh herbs and a squeeze of lemon for a simple yet elegant dinner.,US,4,17,0.964021164021164,911,34,187.0,23.0,7.0,6.0
Strawberry Cream Cheese French Toast Roll-up,"Bite into a delightful twist on a classic breakfast dish with these Strawberry Cream Cheese French Toast Roll-ups! Each roll-up is packed with sweet strawberries and luscious cream cheese, making your mornings irresistibly scrumptious.",US,3,25,0.9317160826594789,1037,76,114.0,7.0,5.0,7.0
Spicy Southwestern-Style Turkey Burgers,"Fire up your taste buds with these Spicy Southwestern-Style Turkey Burgers! Packed with bold flavors and a kick of heat, these juicy patties will make your next cookout a fiesta to remember.",ZZ,4,23,0.9688679245283018,1027,33,447.0,20.0,38.0,4.0
