name,description,country,num_servings,total_time_minutes,user_ratings.score,user_ratings.count_positive,user_ratings.count_negative,nutrition.calories,nutrition.protein,nutrition.fat,nutrition.carbohydrates
Strawberry Banana Pancake Skewers,"Breakfast just got a whole lot more fun with these delightful pancake skewers! Fresh strawberries, sweet bananas, and mini pancakes are skewered together for a playful and tasty twist on a classic breakfast. It's a great way to start your day with a smile!",US,4,30,0.9355400696864111,1074,74,229.0,7.0,6.0,36.0
One-Pot Cheesy Lemon Chicken Pasta,"Whip up a zesty, cheesy delight with this One-Pot Cheesy Lemon Chicken Pasta! It's a perfect weeknight meal that'll have your taste buds dancing and your kitchen clean-up a breeze.",US,5,0,0.9466382070437567,887,50,433.0,41.0,18.0,28.0
Cookies ‘n’ Cream Cake Mix Cookies,"Whip up a batch of these scrumptious Cookies 'n Cream Cake Mix Cookies for a delightful twist on a classic favorite. With a heavenly blend of cake mix and Oreo cookies, your taste buds will be dancing with joy!",US,12,22,0.94129763130793,914,57,182.0,2.0,6.0,30.0
Pizza From Scratch In 20 Minutes Or Less,,ZZ,1,20,0.9176688251618872,992,89,671.0,27.0,24.0,82.0
3-Ingredient Chili-glazed Salmon,"Savor the simplicity of this 3-Ingredient Chili Glazed Salmon that packs a flavorful punch. With just a touch of sweet and spicy, this dish will have your taste buds dancing and begging for more.",US,3,25,0.952565343659245,984,49,109.0,7.0,4.0,7.0
Apple Ring Pancakes,"These apple ring pancakes are a fun and delicious twist on a classic breakfast dish. Made with sliced apples and a fluffy pancake batter, they are a sweet and satisfying breakfast option.",US,3,30,0.8737777777777778,983,142,337.0,9.0,11.0,48.0
Healthy Peanut Butter Chocolate Chip Pancakes,"These pancakes are the perfect combination of sweet and savory, with the rich flavors of peanut butter and chocolate chips. Made with whole wheat flour and no added sugar, they're a healthy breakfast option.",ZZ,4,30,0.8836363636363637,972,128,248.0,8.0,9.0,38.0
Muffin Tin Customizable Veggie Egg Cups,"These muffin tin egg cups are the perfect way to start your day. They're easy to make, and you can customize them with your favorite veggies and cheese!",ZZ,6,30,0.9560315670800451,848,39,61.0,5.0,4.0,0.0
Ramen Carbonara,"Ramen carbonara is a delicious fusion of Italian and Japanese cuisine. This dish features ramen noodles tossed in a creamy egg and cheese sauce, with bacon and black pepper for added flavor.",US,1,25,0.8738828202581926,880,127,1048.0,55.0,66.0,55.0
Breakfast Waffle: The Expert Brunch-er,"The crispy waffle base is topped with a medley of sweet and tart mixed berries, a generous swirl of whipped cream, and a drizzle of pure maple syrup. The finishing touch of rainbow sprinkles adds a fun and colorful twist to this sophisticated breakfast. With every bite, you'll experience a delightful balance of flavors and textures.",US,4,0,0.95,38,2,1106.0,26.0,40.0,162.0
Sun-Dried Tomato & Spinach Tuna Pasta,"Bursting with flavor, this Sun-Dried Tomato Spinach Tuna Pasta is a delightful twist on a classic dish. With a medley of sun-dried tomatoes, spinach, and tuna, this pasta dish is sure to become a weeknight favorite!",US,2,15,0.9069264069264069,838,86,673.0,57.0,16.0,77.0
Cookies & Cream-stuffed Cookies,"Two cookies are better than one, especially when they're stuffed with a creamy, dreamy filling made from crushed chocolate cookies. Bake them until they're just golden brown for a soft and chewy texture that melts in your mouth.",US,8,24,0.9149171270718232,828,77,266.0,2.0,12.0,36.0
Coleslaw,"Craving a classic side dish? Whip up this delightful Coleslaw that's both creamy and tangy, perfect for your next BBQ or picnic. It's a breeze to make and will have everyone coming back for seconds!",US,6,15,0.9638273045507585,826,31,231.0,3.0,17.0,16.0
One-Pot Cheesy Taco Pasta,"Whip up a fiesta in your kitchen with this One-Pot Cheesy Taco Pasta! This mouthwatering dish combines your favorite taco flavors with the comfort of pasta, all in one easy-to-make pot.",US,10,30,0.9601769911504425,868,36,328.0,21.0,13.0,28.0
Banana Peanut Butter French Toast Roll-up,"Go bananas for this scrumptious Banana Peanut Butter French Toast Roll-Up! It's a fun twist on a classic breakfast dish, perfect for a weekend brunch or a special treat.",US,3,25,0.9416745061147695,1001,62,114.0,7.0,5.0,7.0
Buffalo Chickpea Wraps,"Spice up your lunch game with these zesty Buffalo Chickpea Wraps! Packed with flavor and a kick of heat, they're perfect for a satisfying, plant-based meal.",US,2,15,0.9625292740046838,822,32,599.0,25.0,16.0,88.0
Quick 30-Minute Chicken Pho,"Authentic Vietnamese pho is amazing but you don't always have the time to make the real thing. When you are in a pinch try this quick 30-minute chicken ""pho"". Make sure to add your favorite toppings like bean sprouts, jalapenos, thai basil, and don't forget a squeeze of fresh lime.",US,4,30,0.928164196123147,814,63,695.0,56.0,12.0,106.0
Chocolate Peanut Butter Cookie Smoothie,"This chocolate peanut butter cookie smoothie is the perfect way to indulge your sweet tooth. Packed with flavor, this creamy blend of chocolate, peanut butter, banana, and milk of your choosing is like having dessert for breakfast.",US,1,5,0.87511071744907,988,141,654.0,22.0,28.0,87.0
Steak and Avocado Salad,"Savor the irresistible harmony of tender, juicy steak and creamy avocado as they unite in a mouthwatering salad symphony. Each vibrant bite will have you dreaming of sun-soaked picnics and al fresco feasts.",ZZ,4,29,0.9693181818181819,853,27,506.0,30.0,38.0,11.0
Blueberry French Toast In A Mug,"For a sweet and delicious breakfast treat, this blueberry French toast mug is perfect for busy mornings. It's the ideal meal for satisfying your sweet tooth!",ZZ,1,7,0.7219626168224299,927,357,110.0,7.0,6.0,4.0
Cookie Dough Boxed Brownies,"These gooey and rich brownies are elevated to another level with the addition of cookie dough. The soft, chewy texture of the cookie dough pairs perfectly with the dense chocolatey goodness of the brownies.",ZZ,9,25,0.8962053571428571,803,93,687.0,7.0,35.0,92.0
Banana Bread Recipe,"An easy-to-make and satisfying treat, this banana bread recipe combines ripe bananas with simple ingredients like flour and sugar to create a deliciously moist and sweet loaf.",US,1,12,0.8521256931608133,922,160,468.0,11.0,9.0,86.0
Easy 3-Ingredient Chocolate Mousse,Make this easy chocolate dessert with a cool hack! Perfect for Valentine’s Day or anytime you have a craving for chocolate.,US,4,0,0.8759057971014492,967,137,355.0,4.0,16.0,55.0
Avocado Chickpea Salad with Chili Lime Dressing,"Say hello to this vibrant Avocado Chickpea Salad, a refreshing and nutritious twist on a classic dish. Packed with creamy avocado and protein-rich chickpeas, it's the perfect meal to keep you feeling full and satisfied!",US,4,15,0.9668449197860962,904,31,465.0,20.0,13.0,71.0
Dark Chocolate Peanut Butter Banana Protein Smoothie,"Satisfy your sweet tooth and fuel your body with this dark chocolate peanut butter banana protein smoothie, made with cocoa powder, peanut butter, and frozen banana. It's the perfect breakfast or post-workout snack.",ZZ,2,5,0.9526558891454965,825,41,373.0,40.0,7.0,43.0
Peanut Butter S’mores Dip Easy Dessert,"This peanut butter s'mores dip is a fun and easy dessert that's perfect for sharing. Simply melt together chocolate, peanut butter, and marshmallow fluff for a gooey and delicious dip that's perfect with graham crackers or fruit.",US,6,30,0.8905742145178764,822,101,667.0,9.0,24.0,109.0
Creamy Gourmet Hot Chocolate,"This hot chocolate recipe is the definition of decadence! Made with rich chocolate and topped with whipped cream, it's like a hug in a mug. It's the perfect treat to warm you up on a chilly night.",US,4,25,0.8986486486486487,931,105,424.0,4.0,31.0,41.0
5-Ingredient Cauliflower Mac ‘N’ Cheese,"Say hello to a guilt-free comfort food classic with this 5-Ingredient Cauliflower Mac 'n' Cheese! It's a scrumptious, low-carb twist on your favorite cheesy dish that'll have you coming back for seconds.",ZZ,2,20,0.8734321550741163,766,111,399.0,23.0,23.0,29.0
Southwestern Salad With Avocado Dressing,"This southwestern salad with avocado dressing is a fresh and flavorful meal that's perfect for hot summer days. Packed with colorful veggies, protein-rich beans, and a creamy avocado dressing, it's a delicious and healthy option.",US,5,15,0.9625468164794008,771,30,334.0,14.0,15.0,39.0
Chickpea And Black Bean Salad,"A healthy and satisfying salad made with protein-packed chickpeas and black beans, mixed with fresh veggies and a zesty dressing.",US,4,15,0.9672544080604534,768,26,407.0,20.0,10.0,59.0
French-style Lemon Tart,"This French-style lemon tart is a light and refreshing dessert that's perfect for any occasion. With a buttery crust and a tangy lemon filling, it's a delicious way to end any meal.",GB,4,26,0.9454329774614472,797,46,709.0,14.0,47.0,56.0
Avocado Chicken Salad,"A delicious and healthy salad made with tender chicken and creamy avocado, mixed with fresh greens and veggies.",US,4,15,0.9602564102564103,749,31,241.0,23.0,12.0,5.0
Shredded Chicken Tacos,"These tacos are a crowd-pleaser! Tender shredded chicken is seasoned with a blend of spices, then served on warm tortillas and topped with fresh salsa, avocado, and a squeeze of lime. Perfect for a quick and easy weeknight meal.",US,4,23,0.9641943734015346,754,28,222.0,36.0,4.0,8.0
Whole Wheat Pasta With Lemon Kale Chicken,Looking for a healthy and delicious pasta dish? Try this Whole Wheat Pasta with Lemon Kale Chicken recipe! The pasta is mixed with flavorful lemon and garlic sautéed kale and tender chicken making it a satisfying and savory dinner.,ZZ,2,25,0.9353293413173652,781,54,513.0,36.0,14.0,61.0
Sheet-Pan Jambalaya,"This sheet pan jambalaya is packed with bold Cajun flavors and loaded with sausage, shrimp, and chicken. Roasted to perfection with bell peppers and onions, it's a one-pan meal that's perfect for busy weeknights.",US,4,29,0.969248291571754,851,27,1033.0,52.0,11.0,182.0
BBQ Popcorn Chicken,"This finger-lickin' good snack is a party in your mouth. Tender and juicy chicken bites are coated in BBQ sauce potato chips, then coated in crushed BBQ potato chips. Perfect for a quick and easy appetizer or a satisfying snack on the go.",ZZ,5,27,0.8651252408477842,898,140,467.0,21.0,19.0,50.0
Cinnamon Bun French Toast,"Swoon over the sweet, swirled embrace of cinnamon bun French toast, where the allure of cinnamon and sugar meets the custard-soaked tenderness of a breakfast classic. Each heavenly bite will have you floating on a cloud of morning bliss.",US,2,16,0.8609779482262704,898,145,661.0,21.0,47.0,34.0
